{
  "$schema": "https://json-schema.org/draft/2020-12/schema",
  "additionalProperties": false,
  "properties": {
    "base_sha": {"pattern": "^[0-9a-f]{40}$", "type": "string"},
    "final_sha": {"pattern": "^[0-9a-f]{40}$", "type": "string"},
    "findings": {
      "items": {
        "additionalProperties": false,
        "properties": {
          "file": {"minLength": 1, "type": "string"},
          "line": {"minimum": 1, "type": "integer"},
          "message": {"minLength": 1, "type": "string"},
          "severity": {"enum": ["LOW", "MEDIUM", "HIGH", "CRITICAL"]}
        },
        "required": ["severity", "file", "line", "message"],
        "type": "object"
      },
      "type": "array"
    },
    "verdict": {"enum": ["APPROVE", "REQUEST_CHANGES"]}
  },
  "required": ["verdict", "base_sha", "final_sha", "findings"],
  "type": "object"
}
