{
  "base_sha": "20debfafa32877e512f0db6490192cae184473ec",
  "final_sha": "13ba26d23b0becbbe12a51eaf61bd2372fecf9c9",
  "findings": [
    {
      "file": "scripts/validate_structured_review.py",
      "line": 1,
      "message": "A high-severity finding must block approval.",
      "severity": "HIGH"
    }
  ],
  "verdict": "APPROVE"
}
